timestamp,skills,job_role
2025-08-04 13:58:55,"Python, Flask, SQL, APIs, Docker",Software Engineer
2025-08-04 13:58:55,"Accounting, financial analysis, tax, audit",Financial Analyst
2025-08-04 13:58:55,"Machine learning, pandas, TensorFlow, data analysis",Data Scientist
2025-08-04 13:58:55,"React, JavaScript, HTML, CSS, UI design",Frontend Developer
2025-08-04 13:58:55,"Linux, servers, networking, cybersecurity",System Administrator
2025-08-04 13:58:55,"Node.js, React, MongoDB, Express, Docker",Full Stack Developer
2025-08-04 13:58:55,"Java, Spring Boot, PostgreSQL, REST APIs, microservices",Back End Developer
